exp_id	date	tps	mfu_percent	step_time_ms	peak_hbm_gib	config	status	description
baseline	2026-04-22	32900	26.0	249.0	29.69	seq=2048|batch=1|fsdp=4|bf16	keep	initial baseline at seq=2048; NaN loss at seq=2048 flagged; seq=1024 subset clean
baseline-seq1024	2026-04-23	30570	23.0	134.4	n/a	seq=1024|batch=1|fsdp=4|bf16	keep	20-step loss-descent confirmation at seq=1024; loss 3.93 → 1.97; canonical pre-experiment reference
exp01	2026-04-23	24300	n/a	168.3	n/a	seq=1024|batch=1|fsdp=4|bf16|LIBTPU:async_collective_fusion+latency_hiding	discard	async-collective XLA flag bundle; -25% regression; compute-fusion memory traffic blew up
exp02	2026-04-23	0.0	0.0	0.00	0.0	seq=1024|batch=1|fsdp=4|bf16|jit_out_shardings	crash	attempted to pin out_shardings to fix step-1 recompile; tied-weight sharding collapsed to single-device; jit rejected mismatch; reverted
exp03	2026-04-23	23900	n/a	171.4	21.08	seq=1024|batch=1|fsdp=4|bf16|jax.checkpoint(forward_loss)	keep	full activation remat; -22% TPS but -29% peak HBM (95%→67%); memory-first prep for batch growth; loss unchanged
exp04	2026-04-23	27840	n/a	294.3	28.79	seq=1024|batch=2|fsdp=4|bf16|jax.checkpoint(forward_loss)	discard	doubled batch under full remat; +16.5% over exp3 but net -8.9% vs baseline; HBM 92% leaves no headroom for batch=4; chain refuted
exp05	2026-04-23	28035	n/a	146.1	19.32	seq=1024|batch=1|fsdp=4|bf16|jax.checkpoint(forward_loss, checkpoint_dots_with_no_batch_dims)	keep	selective remat; only +8.7% step time (vs full remat's +27.5%); -38% peak HBM (95%→62%); no forward doubling; 11.9 GiB free for batch growth
exp06	2026-04-23	30925	n/a	264.9	25.92	seq=1024|batch=2|fsdp=4|bf16|selective_remat	keep	selective remat + batch=2; first experiment to beat baseline (+1.2% TPS); HBM 83% still has headroom
exp07	2026-04-23	29720	n/a	413.5	30.50	seq=1024|batch=3|fsdp=4|bf16|selective_remat	discard	selective remat + batch=3; HBM 97.6% nearly OOM; per-token cost 33.7 µs (worse than batch=2's 32.3); memory pressure degrades per-token efficiency; batch=2 is the sweet spot
exp08	2026-04-23	31387	n/a	261.0	25.85	seq=1024|batch=2|fsdp=4|bf16|selective_remat|splash_pallas	keep	FIRST PALLAS EXPERIMENT. Swapped XLA SDPA for splash_attention via shard_map+call_jax; +2.7% over baseline (new best); loss match; HBM unchanged at seq=1024 (N² too small to matter); splash adds 122 ms custom-call op replacing part of convolution+loop fusion
exp09	2026-04-23	31148	n/a	263.0	25.76	seq=2048|batch=1|fsdp=4|bf16|selective_remat|splash_pallas	keep	splash + seq=2048 batch=1; *FIXED NaN* that was open since baseline (splash's online-max softmax is numerically stable); loss 3.26→1.50 clean descent; +1.9% TPS over baseline seq=1024; unblocks long-seq training
exp10	2026-04-23	0.0	0.0	0.00	0.0	seq=2048|batch=2|fsdp=4|bf16|selective_remat|splash_pallas|bf16_CE	crash	CompileTimeHbmOom at seq=2048 batch=2 even with bf16 CE saving ~2 GiB fp32 logits; OOM by 1.25 GiB (32.49G > 31.25G); need offload remat
exp11	2026-04-23	0.0	0.0	0.00	0.0	seq=2048|batch=2|fsdp=4|bf16|offload_remat|splash_pallas	crash	offload_dot_with_no_batch_dims (host-offload) didn't reduce compile-time peak; OOM 32.48G of 31.25 (1.24G over) — same as checkpoint variant; XLA planner doesn't account for host-offload as freed HBM at compile time
exp12	2026-04-23	32340	n/a	253.3	24.79	seq=1024|batch=2|fsdp=4|bf16|selective_remat|splash_pallas|bf16_CE	keep	NEW BEST +5.8% over baseline; splash + bf16 CE stack cleanly; loss trajectory identical to exp 8 (fp32 CE) despite bf16 log-softmax — Gemma 4's final_logit_softcapping=30.0 keeps logits bounded so bf16 CE is stable
exp13	2026-04-23	28700	n/a	285.4	n/a	seq=1024|batch=2|fsdp=4|bf16|selective_remat|splash_pallas|bf16_CE|async_collective_flags	discard	async-collective XLA flag bundle revisited on best config (splash+bf16CE); still regresses (+12.7% step time); same mechanism as exp 1 — scheduler reorder breaks compute-fusion locality; permanently park these flags at this scale
exp14	2026-04-23	31960	n/a	256.3	n/a	seq=2048|batch=1|fsdp=4|bf16|selective_remat|splash_pallas|bf16_CE	keep	splash+bf16 CE at seq=2048 b=1 (comparison to exp 9); TPS 31,960 — just below exp 12's 32,340 with same tokens/step; batch=2/seq=1024 edges batch=1/seq=2048 by ~1.2%; bf16 CE saved ~2.5% step time vs exp 9's fp32 CE
exp15	2026-04-23	32717	n/a	375.5	30.87	seq=1024|batch=3|fsdp=4|bf16|selective_remat|splash_pallas|bf16_CE	keep	NEW BEST +7.0% over baseline; batch=3 fits now because splash+bf16 CE freed enough memory (vs exp 7 which OOM'd at 97.6%); HBM 98.78% right at ceiling; loss descent healthy; per-token 30.56 µs
exp16	2026-04-23	32027	n/a	255.8	n/a	seq=1024|batch=2|fsdp=4|bf16|selective_remat|splash_pallas|bf16_CE|fused_bwd_kernel=True(broken)	invalid	set use_fused_bwd_kernel=True but left dq block-size params set; splash errored with 'Block sizes for dq kernel are not needed with a fused kernel'; XLA fallback fired for every layer — this number is XLA attention, not splash-fused-bwd; need to omit block_q_dq/block_kv_dq when fused_bwd=True (exp 17 branch does this); interesting side-finding: XLA fallback at this config is within 2 ms of splash
exp17	2026-04-23	32663	n/a	250.8	TBD	seq=1024|batch=2|fsdp=4|bf16|selective_remat|splash_pallas|bf16_CE|fused_bwd_kernel=True	keep	splash fused_bwd_kernel with correct block-size config; +0.9% over exp 12 / +6.8% over baseline; loss match; saved ~2.5 ms/step on bwd pass; on its own branch perfautoresearch/v6e4-20260423-exp17-splash-fused-bwd, merged to trunk
exp18	2026-04-23	33016	n/a	n/a	n/a	seq=1024|batch=3|fsdp=4|bf16|selective_remat|splash_pallas|bf16_CE|fused_bwd_kernel=True	keep	fused_bwd + batch=3 on top of exp 17; +8.0% over baseline; merged to trunk; per-exp md writeup TBD (gap in wiki filing)
exp19	2026-04-23	n/a	n/a	n/a	n/a	seq=1024|batch=2|fsdp=4|bf16|selective_remat|splash_pallas|bf16_CE|fused_bwd|splash_block=256	discard	splash block sizes 512 -> 256 (fine-grain tiles); not merged; writeup TBD
exp20	2026-04-23	n/a	n/a	n/a	n/a	seq=1024|batch=2|fsdp=4|bf16|selective_remat|splash_pallas|bf16_CE|fused_bwd|pallas_rmsnorm(pallas-forge)	invalid	pallas-forge RMSNorm has no custom_vjp; backward errored; not merged; future work = hand-rolled vjp; writeup TBD
exp21	2026-04-23	n/a	n/a	n/a	n/a	seq=1024|batch=2|fsdp=4|bf16|selective_remat|splash_pallas|bf16_CE|fused_bwd|latency_hiding_scheduler	discard	latency-hiding scheduler revisited on splash+fused-bwd best; same compute-locality regression pattern as exp1/exp13; not merged; writeup TBD
exp22	2026-04-23	n/a	n/a	n/a	n/a	seq=1024|batch=4|fsdp=4|bf16|selective_remat|splash_pallas|bf16_CE|fused_bwd	crash	batch=4 at splash+fused-bwd best; OOM at compile time; consistent with ~1.25 GiB compile-overhead pattern; not merged; writeup TBD
exp23	2026-04-23	n/a	n/a	n/a	n/a	seq=2048|batch=2|fsdp=4|bf16|selective_remat|splash_pallas|bf16_CE|fused_bwd	crash	seq=2048 b=2 still OOM at compile even with splash+fused-bwd; not merged; writeup TBD
exp24	2026-04-23	33193	n/a	n/a	n/a	seq=1024|batch=3|fsdp=4|bf16|selective_remat|splash_pallas|bf16_CE|fused_bwd|QKVLayout.SEQ_MINOR	keep	splash QKV layout flipped HEAD_DIM_MINOR -> SEQ_MINOR; +0.5% marginal new best; merged to trunk; writeup TBD
exp25	2026-04-23	33372	n/a	n/a	n/a	seq=1024|batch=3|fsdp=4|bf16|selective_remat|splash_pallas|bf16_CE|fused_bwd|SEQ_MINOR|splash_block=1024	keep	splash block sizes 512 -> 1024 (whole-seq one-block attention); +0.6% over exp 24; NEW BEST +9.2% over baseline; merged to trunk; writeup TBD
exp26	2026-04-23	n/a	n/a	n/a	n/a	seq=1024|batch=3|fsdp=4|bf16|best_exp25_stack|scan_over_layers(diagnostic)	parked	scan-over-layers investigation; Option A blocked by 5 Gemma4-specific issues (kwargs/heterogeneous state_dict/Python int layer_idx/side-effect dict carry/indexed per-layer inputs); Option B (custom scan + stacked weights + kv-carry) scoped into 7 sub-problems B1-B7, deferred; scaffold scan_layers.py committed on branch only (NOT merged); diagnostic-only, no perf delta; writeup 2026-04-23-exp26-scan-over-layers-potential.md
exp27	2026-04-23	n/a	n/a	n/a	n/a	seq=1024|batch=3|fsdp=4|bf16|best_exp25_stack|tokamax_dpa(mosaic_tpu)	parked	tokamax.dot_product_attention(implementation=mosaic) for use_base2_exp; tokamax's pallas_mosaic_tpu_common raises NotImplementedError on mask.k_start (sliding-window); 21/42 Gemma4 layers fall back to XLA — fatal; also fixed absl FLAGS pre-parse bug en route; code wired but not merged; writeup 2026-04-23-exp27-tokamax-dpa-potential.md
exp28	2026-04-23	32251	n/a	254.01	TBD	seq=2048|batch=1|fsdp=4|bf16|selective_remat|splash_pallas|bf16_CE|fused_bwd|SEQ_MINOR|splash_block=1024	keep	exp25 stack at seq=2048 b=1; +0.9% over exp 14 (31,960); NOT new overall best (exp25 seq=1024 b=3 still leads at 33,372); per-step tight (σ<0.4ms); loss 3.27→1.98 clean; branch only (not merged — strictly dominated by exp25); writeup 2026-04-23-exp28-seq2048-exp25config-accepted.md
exp29	2026-04-23	33247	n/a	369.62	TBD	seq=1024|batch=3|fsdp=4|bf16|selective_remat|splash_pallas|bf16_CE|fused_bwd|SEQ_MINOR|block_q=1024|block_kv=512	discard	asymmetric splash blocks (block_q=1024, block_kv=512) vs exp25 symmetric 1024; -0.37% TPS (within noise, directionally worse); splash softmax-accumulator is sequential across KV tiles so smaller kv adds reload cost with no concurrency gain; symmetric 1024 is the sweet spot at seq=1024; not merged; writeup 2026-04-23-exp29-splash-asymmetric-rejected.md
exp30	2026-04-23	33371	n/a	368.23	TBD	seq=1024|batch=3|fsdp=4|bf16|best_exp25_stack|LIBTPU:latency_hiding_scheduler=true	inconclusive	latency_hiding_scheduler flag in isolation; -0.003% (statistically identical to exp25); clears this flag as a culprit for exp1/13/21 bundle regression — the bad actors are async_collective_fusion*; +15% compile cost (no production value); not merged; writeup 2026-04-23-exp30-latency-hiding-solo-potential.md
exp31	2026-04-23	33330	n/a	368.67	TBD	seq=1024|batch=3|fsdp=4|bf16|best_exp25_stack|LIBTPU:overlap_compute_collective_tc=true	inconclusive	overlap_compute_collective_tc flag in isolation; -0.13% (flat/noise); combined with exp30 confirms async_collective_fusion* is the culprit in exp1/13/21 bundle; not merged; writeup 2026-04-23-exp31-overlap-compute-collective-tc-potential.md
exp32	2026-04-23	12711	n/a	322.23	TBD	seq=1024|batch=2|mesh=dp2xtp2|bf16|selective_remat|splash_pallas|bf16_CE|fused_bwd|SEQ_MINOR|block=1024	discard	2D mesh dp=2 tp=2 hybrid sharding; batch=3 compile-OOM by 1.15GiB (~same pattern as exp10/11); batch=2 ran at 12,711 TPS vs baseline's 30,570 at same global batch=4 — 2.4x slower; TP collectives dominate at 2 chips/axis; refuted, not merged; sharding.py got rank-guards + hybrid 2D logic; pallas_attention.py got 2D shard_map path; writeup 2026-04-23-exp32-2d-mesh-tp2-rejected.md
exp33	2026-04-23	30657	n/a	400.82	TBD	seq=1024|batch=3|fsdp=4|bf16|best_exp25_stack|pallas_rmsnorm(hand_custom_vjp)	discard	hand-written Pallas RMSNorm forward + hand-rolled custom_vjp backward for Gemma4RMSNorm (250+ calls/step); kernel numerics verified vs JAX reference to bf16 eps; loss trajectory preserved (step 4 loss 2.19 matches exp25); TPS 30,657 = -8.1% vs exp25; refuted — custom-call boundaries break XLA loop_fusion across norm/matmul seam so each norm gets 2x extra HBM round-trips; shard_map launch overhead adds ~25 ms/step for 250 calls; kernel correct but integration-cost story wrong; not merged; writeup 2026-04-23-exp33-pallas-rmsnorm-rejected.md
